{
  "id": "claude-assist",
  "name": "AI assistant example: call the local Claude Code CLI with the input",
  "version": 1,
  "description": "Demonstrates ctx.tools.exec calling the system claude CLI and passing the result back into the flow (run tb allow add \"claude *\" first)",
  "trigger": { "type": "webhook" },
  "nodes": [
    {
      "id": "ask",
      "type": "code",
      "name": "Call Claude",
      "timeoutMs": 180000,
      "code": "async function run(ctx) {\n  const question = ctx.trigger.payload.question || \"Introduce yourself in one sentence\";\n  ctx.tools.log(\"question:\", question);\n  const r = await ctx.tools.exec(\n    `claude -p ${JSON.stringify(question + \" (answer concisely)\")}`,\n    { timeoutMs: 150000 }\n  );\n  if (r.exitCode !== 0) { ctx.tools.fail(\"claude call failed: \" + r.stderr.slice(0, 200)); }\n  return { question: question, answer: r.stdout.trim() };\n}"
    },
    {
      "id": "check",
      "type": "if",
      "name": "Notify only when there is an answer",
      "condition": "nodes.ask.output.answer.length > 0",
      "then": [
        {
          "id": "notify",
          "type": "action",
          "name": "System notification",
          "action": "notify",
          "params": {
            "title": "Claude answer ({{config.flowName}})",
            "body": "{{nodes.ask.output.answer}}"
          }
        }
      ],
      "else": []
    }
  ]
}
