{
  "id": "hello",
  "name": "Example: data processing pipeline",
  "version": 1,
  "description": "Demonstrates combining code + if + loop + action nodes, plus external payload injection",
  "trigger": { "type": "manual" },
  "nodes": [
    {
      "id": "seed",
      "type": "code",
      "name": "Prepare data",
      "code": "async function run(ctx) {\n  const payload = ctx.trigger.payload || {};\n  ctx.tools.log('received input:', JSON.stringify(payload));\n  const base = Number(payload.base) || 10;\n  return { base: base, items: [base + 1, base + 2, base + 3] };\n}"
    },
    {
      "id": "check",
      "type": "if",
      "name": "Continue only when data exists",
      "condition": "nodes.seed.output.items.length > 0",
      "then": [
        {
          "id": "each",
          "type": "loop",
          "mode": "forEach",
          "name": "Process each item",
          "over": "{{nodes.seed.output.items}}",
          "body": [
            {
              "id": "double",
              "type": "code",
              "name": "Double (break early above 100)",
              "code": "async function run(ctx) {\n  const value = ctx.loop.item;\n  if (value > 100) { return { $loop: 'break' }; }\n  return { doubled: value * 2 };\n}"
            }
          ]
        },
        { "id": "pause", "type": "action", "name": "Brief pause", "action": "delay", "params": { "ms": 10 } }
      ],
      "else": []
    },
    {
      "id": "summary",
      "type": "code",
      "name": "Summarize",
      "code": "async function run(ctx) {\n  const results = ctx.nodes.each.output.results;\n  return { total: results.length, results: results };\n}"
    }
  ]
}
